{
  "schema_version": 1,
  "run_id": "example-synthetic",
  "created_at": "2026-09-16T00:00:00Z",
  "catalog": {
    "path": "evals/evals.json",
    "sha256": "ea6e776fe67d0fd624771ccbc967afc6a42f6fba9e67f17a28dda1576b445e2e"
  },
  "model": "example-harness",
  "notes": "格式示例，不代表真实质量结论。",
  "variants": {
    "with_skill": {
      "label": "当前 skill（synthetic）",
      "gates": true,
      "skill_revision": "d2d422d",
      "cases": [
        {
          "case_id": 1,
          "metrics": {
            "duration_ms": 1100,
            "tool_calls": 1,
            "tokens": {
              "input": 100,
              "output": 200
            }
          },
          "expectation_results": [
            {
              "expectation_index": 1,
              "status": "pass",
              "reason": "Synthetic fixture result; replace with an independent evaluation record.",
              "evidence": [
                {
                  "kind": "review",
                  "locator": "evals/fixtures/example-review.json#case-1-expectation-1"
                }
              ]
            },
            {
              "expectation_index": 2,
              "status": "pass",
              "reason": "Synthetic fixture result; replace with an independent evaluation record.",
              "evidence": [
                {
                  "kind": "review",
                  "locator": "evals/fixtures/example-review.json#case-1-expectation-2"
                }
              ]
            },
            {
              "expectation_index": 3,
              "status": "pass",
              "reason": "Synthetic fixture result; replace with an independent evaluation record.",
              "evidence": [
                {
                  "kind": "review",
                  "locator": "evals/fixtures/example-review.json#case-1-expectation-3"
                }
              ]
            },
            {
              "expectation_index": 4,
              "status": "pass",
              "reason": "Synthetic fixture result; replace with an independent evaluation record.",
              "evidence": [
                {
                  "kind": "review",
                  "locator": "evals/fixtures/example-review.json#case-1-expectation-4"
                }
              ]
            }
          ]
        },
        {
          "case_id": 2,
          "metrics": {
            "duration_ms": 1200,
            "tool_calls": 2,
            "tokens": {
              "input": 100,
              "output": 200
            }
          },
          "expectation_results": [
            {
              "expectation_index": 1,
              "status": "pass",
              "reason": "Synthetic fixture result; replace with an independent evaluation record.",
              "evidence": [
                {
                  "kind": "review",
                  "locator": "evals/fixtures/example-review.json#case-2-expectation-1"
                }
              ]
            },
            {
              "expectation_index": 2,
              "status": "pass",
              "reason": "Synthetic fixture result; replace with an independent evaluation record.",
              "evidence": [
                {
                  "kind": "review",
                  "locator": "evals/fixtures/example-review.json#case-2-expectation-2"
                }
              ]
            },
            {
              "expectation_index": 3,
              "status": "pass",
              "reason": "Synthetic fixture result; replace with an independent evaluation record.",
              "evidence": [
                {
                  "kind": "review",
                  "locator": "evals/fixtures/example-review.json#case-2-expectation-3"
                }
              ]
            },
            {
              "expectation_index": 4,
              "status": "pass",
              "reason": "Synthetic fixture result; replace with an independent evaluation record.",
              "evidence": [
                {
                  "kind": "review",
                  "locator": "evals/fixtures/example-review.json#case-2-expectation-4"
                }
              ]
            }
          ]
        },
        {
          "case_id": 3,
          "metrics": {
            "duration_ms": 1300,
            "tool_calls": 3,
            "tokens": {
              "input": 100,
              "output": 200
            }
          },
          "expectation_results": [
            {
              "expectation_index": 1,
              "status": "pass",
              "reason": "Synthetic fixture result; replace with an independent evaluation record.",
              "evidence": [
                {
                  "kind": "review",
                  "locator": "evals/fixtures/example-review.json#case-3-expectation-1"
                }
              ]
            },
            {
              "expectation_index": 2,
              "status": "pass",
              "reason": "Synthetic fixture result; replace with an independent evaluation record.",
              "evidence": [
                {
                  "kind": "review",
                  "locator": "evals/fixtures/example-review.json#case-3-expectation-2"
                }
              ]
            },
            {
              "expectation_index": 3,
              "status": "pass",
              "reason": "Synthetic fixture result; replace with an independent evaluation record.",
              "evidence": [
                {
                  "kind": "review",
                  "locator": "evals/fixtures/example-review.json#case-3-expectation-3"
                }
              ]
            },
            {
              "expectation_index": 4,
              "status": "pass",
              "reason": "Synthetic fixture result; replace with an independent evaluation record.",
              "evidence": [
                {
                  "kind": "review",
                  "locator": "evals/fixtures/example-review.json#case-3-expectation-4"
                }
              ]
            }
          ]
        },
        {
          "case_id": 4,
          "metrics": {
            "duration_ms": 1400,
            "tool_calls": 4,
            "tokens": {
              "input": 100,
              "output": 200
            }
          },
          "expectation_results": [
            {
              "expectation_index": 1,
              "status": "pass",
              "reason": "Synthetic fixture result; replace with an independent evaluation record.",
              "evidence": [
                {
                  "kind": "review",
                  "locator": "evals/fixtures/example-review.json#case-4-expectation-1"
                }
              ]
            },
            {
              "expectation_index": 2,
              "status": "pass",
              "reason": "Synthetic fixture result; replace with an independent evaluation record.",
              "evidence": [
                {
                  "kind": "review",
                  "locator": "evals/fixtures/example-review.json#case-4-expectation-2"
                }
              ]
            },
            {
              "expectation_index": 3,
              "status": "pass",
              "reason": "Synthetic fixture result; replace with an independent evaluation record.",
              "evidence": [
                {
                  "kind": "review",
                  "locator": "evals/fixtures/example-review.json#case-4-expectation-3"
                }
              ]
            },
            {
              "expectation_index": 4,
              "status": "pass",
              "reason": "Synthetic fixture result; replace with an independent evaluation record.",
              "evidence": [
                {
                  "kind": "review",
                  "locator": "evals/fixtures/example-review.json#case-4-expectation-4"
                }
              ]
            }
          ]
        },
        {
          "case_id": 5,
          "metrics": {
            "duration_ms": 1500,
            "tool_calls": 5,
            "tokens": {
              "input": 100,
              "output": 200
            }
          },
          "expectation_results": [
            {
              "expectation_index": 1,
              "status": "pass",
              "reason": "Synthetic fixture result; replace with an independent evaluation record.",
              "evidence": [
                {
                  "kind": "review",
                  "locator": "evals/fixtures/example-review.json#case-5-expectation-1"
                }
              ]
            },
            {
              "expectation_index": 2,
              "status": "pass",
              "reason": "Synthetic fixture result; replace with an independent evaluation record.",
              "evidence": [
                {
                  "kind": "review",
                  "locator": "evals/fixtures/example-review.json#case-5-expectation-2"
                }
              ]
            },
            {
              "expectation_index": 3,
              "status": "pass",
              "reason": "Synthetic fixture result; replace with an independent evaluation record.",
              "evidence": [
                {
                  "kind": "review",
                  "locator": "evals/fixtures/example-review.json#case-5-expectation-3"
                }
              ]
            },
            {
              "expectation_index": 4,
              "status": "pass",
              "reason": "Synthetic fixture result; replace with an independent evaluation record.",
              "evidence": [
                {
                  "kind": "review",
                  "locator": "evals/fixtures/example-review.json#case-5-expectation-4"
                }
              ]
            }
          ]
        },
        {
          "case_id": 6,
          "metrics": {
            "duration_ms": 1600,